MGH/Chelsea Emergency Food Pantry Ruiz Park Mobile Market ,"141 Washington St. Chelsea, MA 02150 "
USCCB/ The Paulist Center and Wed. Supper Club,"5 Park St. Boston, MA 02108 "
St Anthony Shrine/Franciscan Food Center,"100 Arch Street Boston, MA 02110 "
ABCD/ West End Senior Center ,"151 Cambridge St Boston, MA 02114"
Boston Rescue Mission / Pantry & Meals,"39 Kingston St. Boston, MA 02111 "
St. Francis House Meals ,"39 Boylston St. Boston, MA 02116 "
ABCD N. End/W.End Pantry and Neighborhood Services ,"1 Michelangelo Street Boston, MA 02113 "
Friday Night Supper ,"351 Boylston St. Boston, MA 02116 "
Rice Sticks and Tea/Asian Food Pantry ,"351 Boylston St. Boston, MA 02116 "
Church of the Covenant ,"67 Newbury St. Boston, MA 02116 "
Women’s Lunch Place ,"67 Newbury St. Boston, MA 02116 "
Victory Programs/Boston Living Center Meals Program ,"29 Stanhope Street Boston, MA 02116 "
BHCC - DISH Pantry ,"250 Rutherford Ave. Charlestown, MA 02129"
YMCA Boston/East Boston Community Soup Kitchen Mobile Market ,"28 Paris St. East Boston, MA 02128"
Pine Street Inn/Meals ,"444 Harrison Ave. Boston, MA 02118  "
The Harvest on Vine ,"49 Vine Street Charlestown, MA 02129 "
Holy Redeemer Church/Our Daily Bread Pty,"56 Havre Street East Boston, MA 02128 "
YMCA Boston/Church Faro De Luz ,"32 Bremen Street East Boston, MA 02128 "
Haley House Food Pantry & Soup Kitchen ,"23 Dartmouth Street Boston, MA 02116"
East End House Pantry ,"105 Spring Street Cambridge, MA 02141 "
TBU DBA Outreach Van Project ,"197 Border St. East Boston, MA02128 "
YMCA Boston/Paris St BCYF (MML),"112 Paris Street Boston, MA 02128 "
CCAB/EL Centro Del Cardena ,"Monsignor Reynolds Way Boston, MA 0211 "
,
,
,
,
